{
  "id": "axiom-honesty-in-dealings",
  "type": "axiom",
  "name": "Be truthful in agreements and dealings",
  "plainSummary": "In legal and private relationships, people should tell the truth, avoid misleading others, and disclose what fairness requires—not exploit silence or fine print in bad faith.",
  "whyRoot": "Voluntary cooperation rests on a shared picture of reality: if people can lie or hide what matters, planning, exchange, and trust break down. We treat honesty as a stopping point because without it, weaker parties are easy to manipulate and almost nothing else in private law can be relied on.",
  "description": "Foundational commitment that veracity and good-faith disclosure matter in forming, performing, and interpreting obligations; a building block for doctrines of fraud, misrepresentation, and implied duties in many legal systems.",
  "tags": ["foundational", "roman-law", "contracts", "civil-law", "honesty"],
  "citations": {},
  "createdAt": "2026-03-29",
  "updatedAt": "2026-03-30"
}
