{
  "id": "axiom-fidelity-to-agreements",
  "type": "axiom",
  "name": "Keep the spirit of your agreements",
  "plainSummary": "Once you undertake a commitment, you should stand by its purpose and reasonable expectations—not only the narrowest reading that benefits you.",
  "whyRoot": "Promises coordinate expectations over time. If people could always dodge the point of a deal whenever a loophole appeared, others could not rely on undertakings, and cooperation would stall. Fidelity to the bargain is foundational because it is what makes words actually binding in practice.",
  "description": "Foundational commitment to loyalty to the bargain (allied with pacta-related ideas in many traditions): performance and interpretation should respect the agreement’s intent and the trust the other party reasonably placed in you.",
  "tags": ["foundational", "roman-law", "contracts", "civil-law", "fidelity"],
  "citations": {},
  "createdAt": "2026-03-29",
  "updatedAt": "2026-03-30"
}
