{
  "id": "axiom-written-constitution-as-supreme-law",
  "type": "axiom",
  "name": "A written constitution is the highest law",
  "plainSummary": "The basic rules of government should be written in a charter that sits above ordinary laws: it divides power, sets up institutions, and limits what legislatures can do.",
  "whyRoot": "Power needs stable, public limits so people can plan their lives and hold rulers accountable. A supreme written charter is a root in this tradition because it makes those limits visible and harder to erase in a single ordinary vote.",
  "description": "Foundational commitment that political authority should be structured by a written charter that allocates powers, defines institutions, and stands above ordinary legislation—central to the U.S. federal order.",
  "tags": ["foundational", "us-law", "constitutional-law"],
  "citations": {},
  "createdAt": "2026-03-29",
  "updatedAt": "2026-03-29"
}
